Question	Answer
Comment puis-je demander l'accès au SSCDL ?	\n **Comment puis-je demander l'accès au SSCDL ?** \n  
"Pourquoi est-ce que je reçois le message d'erreur ""Niveau d'assurance insuffisant"" lorsque j'essaie de soumettre mon rapport mensuel dans SSCDL ?"	"\n **Pourquoi est-ce que je reçois le message d'erreur ""Niveau d'assurance insuffisant"" lorsque j'essaie de soumettre mon rapport mensuel dans SSCDL ?** \n  "
"Pourquoi est-ce que je reçois le message d'erreur ""Le fichier n'a pas pu être soumis parce que des erreurs ont été trouvées"" lorsque j'essaie de soumettre mon rapport mensuel dans SSCDL ?"""	"\n **Pourquoi est-ce que je reçois le message d'erreur ""Le fichier n'a pas pu être soumis parce que des erreurs ont été trouvées"" lorsque j'essaie de soumettre mon rapport mensuel dans SSCDL ?""** \n  "
"Pourquoi est-ce que je reçois le message d'erreur ""Un rapport existe déjà pour cette période de rapport"" lorsque j'essaie de soumettre mon rapport mensuel dans SSCDL ?"""	"\n **Pourquoi est-ce que je reçois le message d'erreur ""Un rapport existe déjà pour cette période de rapport"" lorsque j'essaie de soumettre mon rapport mensuel dans SSCDL ?""** \n  "
Comment visualiser ou modifier un rapport une fois qu'il a été soumis dans SSCDL ?	\n **Comment visualiser ou modifier un rapport une fois qu'il a été soumis dans SSCDL ?** \n  
Pouvez-vous expliquer la différence entre le stock non fini et le stock fini (non emballé et emballé) ?	\n **Pouvez-vous expliquer la différence entre le stock non fini et le stock fini (non emballé et emballé) ?** \n  
Qu'est-ce que j'enregistre dans la section Ventes ?	\n **Qu'est-ce que j'enregistre dans la section Ventes ?** \n  
